id,subject,sentence,gender
93_SUB8,SUB8,Saya akan tiba tepat waktu,male
94_SUB8,SUB8,Kami akan menunggu Anda,male
95_SUB8,SUB8,Kecewa dengan upaya Anda,male
96_SUB8,SUB8,Kita harus saling membantu,male
97_SUB8,SUB8,Semoga perjalanan Anda menyenangkan,male
98_SUB8,SUB8,Bicaranya tidak ada habisnya,male
99_SUB8,SUB8,Saya sedang belajar memasak,male
100_SUB8,SUB8,Apakah kalian punya keju?,male
1_SUB10,SUB10,"Selamat pagi, ada yang bisa dibantu?",female
2_SUB10,SUB10,"Selamat datang, ada yang bisa saya bantu?",female
3_SUB10,SUB10,Boleh minta tolong?,female
4_SUB10,SUB10,Kamu terlihat luar biasa,female
5_SUB10,SUB10,Mari kita bicara di luar,female
6_SUB10,SUB10,"Maaf, membuat Anda menunggu lama",female
7_SUB10,SUB10,Saya ingin pergi makan sesuatu,female
8_SUB10,SUB10,Sudah waktunya tidur,female
9_SUB10,SUB10,Apakah Anda ingin mencoba hidangan lainnya?,female
10_SUB10,SUB10,Kita pernah bertemu tahun lalu,female
11_SUB10,SUB10,"Maaf, kemarin saya tidak masuk kelas",female
12_SUB10,SUB10,Anda seharusnya merasa malu,female
13_SUB10,SUB10,Dia bekerja paling rajin,female
14_SUB10,SUB10,Penjelasan Anda tidak meyakinkan bagi saya,female
15_SUB10,SUB10,Mari ikut saya ke kantor untuk bicara lebih lanjut,female
16_SUB10,SUB10,Saya menikmati waktu yang menyenangkan,female
17_SUB10,SUB10,Kucing itu sangat cantik dan lucu,female
18_SUB10,SUB10,Anda terlihat sangat lelah,female
19_SUB10,SUB10,Pilihan Anda banyak sekali ya,female
20_SUB10,SUB10,Lain kali pasti akan lebih baik,female
21_SUB10,SUB10,Dia sangat tidak bisa diandalkan,female
22_SUB10,SUB10,Kita akan tetap saling berkabar,female
23_SUB10,SUB10,Saya tidak percaya penjelasan Anda,female
24_SUB10,SUB10,Mau tambah nasi lagi?,female
25_SUB10,SUB10,Mengapa dia tidak menang?,female
26_SUB10,SUB10,Mari kita akhiri rapatnya,female
27_SUB10,SUB10,Profesor itu memberikan kesan yang mendalam,female
28_SUB10,SUB10,Apakah sebelumnya kita pernah bertemu?,female
29_SUB10,SUB10,Kami biasanya makan di kantin,female
30_SUB10,SUB10,Layanan makanan tersedia di pesawat,female
31_SUB10,SUB10,Apa yang Anda lakukan di waktu luang?,female
32_SUB10,SUB10,Kapan pesawat akan tiba?,female
33_SUB10,SUB10,Kamu adalah penyelamat hidupku,female
34_SUB10,SUB10,Saya setuju dengan semua kebijakannya,female
35_SUB10,SUB10,Kamu boleh mencobanya,female
36_SUB10,SUB10,Dia adalah pelari terbaik yang pernah saya temui,female
37_SUB10,SUB10,Kamu adalah pahlawanku,female
38_SUB10,SUB10,Kita pergi nanti saja,female
39_SUB10,SUB10,Semoga Anda bersenang-senang,female
40_SUB10,SUB10,Apakah ada restoran Jepang di sekitar sini?,female
41_SUB10,SUB10,Matanya sangat indah,female
42_SUB10,SUB10,Apakah sarapan sudah siap?,female
43_SUB10,SUB10,Aku sedang menelepon teman,female
44_SUB10,SUB10,Berikan mikrofonnya kepada dia,female
45_SUB10,SUB10,Kamu harus pergi melihatnya,female
46_SUB10,SUB10,Kami akan merapikan dokumen besok,female
47_SUB10,SUB10,Konsep lama sulit untuk diubah,female
48_SUB10,SUB10,Apakah ada waktu luang sore ini?,female
49_SUB10,SUB10,Dia sedang mencari tesisnya yang hilang,female
50_SUB10,SUB10,Jangan percaya apa yang dia katakan,female
